{
  "version": 1,
  "generatedFrom": [
    "config/page-character-manifest.json",
    "config/omega-world-manifest.json",
    "repository HTML tree"
  ],
  "purpose": "Canonical page-to-world action map. It assigns every deployed HTML page a role, purpose bridge, action set, outcome, district and existing navigation destinations without inventing backend state.",
  "sourceOfTruth": "The page implementation remains authoritative for actual behavior; this registry is a navigation/gameplay contract only.",
  "pageCount": 214,
  "pages": [
    {
      "page": "404.html",
      "slug": "404",
      "archetype": "command",
      "role": "Navigator",
      "verb": "DIRECT",
      "primaryAction": "decide",
      "actions": [
        "decide",
        "accept mission",
        "review standing"
      ],
      "successOutcome": "mission accepted",
      "district": "genesis",
      "districtName": "THE GENESIS QUARTER",
      "entry": "/404.html",
      "mission": "/missions.html",
      "reward": "/achievements.html"
    },
    {
      "page": "academy.html",
      "slug": "academy",
      "archetype": "knowledge",
      "role": "Scholar",
      "verb": "MASTER",
      "primaryAction": "learn",
      "actions": [
        "learn",
        "practice",
        "verify",
        "certify"
      ],
      "successOutcome": "knowledge verified",
      "district": "academy",
      "districtName": "THE ACADEMY CAMPUS",
      "entry": "/academy.html",
      "mission": "/missions.html",
      "reward": "/achievements.html"
    },
    {
      "page": "account.html",
      "slug": "account",
      "archetype": "identity",
      "role": "Avatar",
      "verb": "BECOME",
      "primaryAction": "customize",
      "actions": [
        "customize",
        "equip",
        "present"
      ],
      "successOutcome": "identity advanced",
      "district": "genesis",
      "districtName": "THE GENESIS QUARTER",
      "entry": "/account.html",
      "mission": "/missions.html",
      "reward": "/achievements.html"
    },
    {
      "page": "achievements.html",
      "slug": "achievements",
      "archetype": "command",
      "role": "Navigator",
      "verb": "DIRECT",
      "primaryAction": "decide",
      "actions": [
        "decide",
        "accept mission",
        "review standing"
      ],
      "successOutcome": "mission accepted",
      "district": "arena",
      "districtName": "THE GAME ARENA",
      "entry": "/achievements.html",
      "mission": "/missions.html",
      "reward": "/achievements.html"
    },
    {
      "page": "ad-network.html",
      "slug": "ad-network",
      "archetype": "command",
      "role": "Navigator",
      "verb": "DIRECT",
      "primaryAction": "decide",
      "actions": [
        "decide",
        "accept mission",
        "review standing"
      ],
      "successOutcome": "mission accepted",
      "district": "genesis",
      "districtName": "THE GENESIS QUARTER",
      "entry": "/ad-network.html",
      "mission": "/missions.html",
      "reward": "/achievements.html"
    },
    {
      "page": "advertising.html",
      "slug": "advertising",
      "archetype": "command",
      "role": "Navigator",
      "verb": "DIRECT",
      "primaryAction": "decide",
      "actions": [
        "decide",
        "accept mission",
        "review standing"
      ],
      "successOutcome": "mission accepted",
      "district": "genesis",
      "districtName": "THE GENESIS QUARTER",
      "entry": "/advertising.html",
      "mission": "/missions.html",
      "reward": "/achievements.html"
    },
    {
      "page": "affirmations.html",
      "slug": "affirmations",
      "archetype": "command",
      "role": "Navigator",
      "verb": "DIRECT",
      "primaryAction": "decide",
      "actions": [
        "decide",
        "accept mission",
        "review standing"
      ],
      "successOutcome": "mission accepted",
      "district": "wellness",
      "districtName": "THE WELLNESS DISTRICT",
      "entry": "/affirmations.html",
      "mission": "/missions.html",
      "reward": "/achievements.html"
    },
    {
      "page": "agent-network.html",
      "slug": "agent-network",
      "archetype": "command",
      "role": "Navigator",
      "verb": "DIRECT",
      "primaryAction": "decide",
      "actions": [
        "decide",
        "accept mission",
        "review standing"
      ],
      "successOutcome": "mission accepted",
      "district": "genesis",
      "districtName": "THE GENESIS QUARTER",
      "entry": "/agent-network.html",
      "mission": "/missions.html",
      "reward": "/achievements.html"
    },
    {
      "page": "agent-operations.html",
      "slug": "agent-operations",
      "archetype": "command",
      "role": "Navigator",
      "verb": "DIRECT",
      "primaryAction": "decide",
      "actions": [
        "decide",
        "accept mission",
        "review standing"
      ],
      "successOutcome": "mission accepted",
      "district": "genesis",
      "districtName": "THE GENESIS QUARTER",
      "entry": "/agent-operations.html",
      "mission": "/missions.html",
      "reward": "/achievements.html"
    },
    {
      "page": "agents.html",
      "slug": "agents",
      "archetype": "intelligence",
      "role": "Seeker",
      "verb": "DISCOVER",
      "primaryAction": "investigate",
      "actions": [
        "investigate",
        "consult",
        "compare",
        "trace"
      ],
      "successOutcome": "insight recorded",
      "district": "intelligence",
      "districtName": "THE INTELLIGENCE HUB",
      "entry": "/agents.html",
      "mission": "/missions.html",
      "reward": "/achievements.html"
    },
    {
      "page": "analytics.html",
      "slug": "analytics",
      "archetype": "intelligence",
      "role": "Seeker",
      "verb": "DISCOVER",
      "primaryAction": "investigate",
      "actions": [
        "investigate",
        "consult",
        "compare",
        "trace"
      ],
      "successOutcome": "insight recorded",
      "district": "intelligence",
      "districtName": "THE INTELLIGENCE HUB",
      "entry": "/analytics.html",
      "mission": "/missions.html",
      "reward": "/achievements.html"
    },
    {
      "page": "approvals.html",
      "slug": "approvals",
      "archetype": "governance",
      "role": "Councillor",
      "verb": "GOVERN",
      "primaryAction": "review",
      "actions": [
        "review",
        "approve",
        "audit",
        "decide"
      ],
      "successOutcome": "governance action recorded",
      "district": "genesis",
      "districtName": "THE GENESIS QUARTER",
      "entry": "/approvals.html",
      "mission": "/missions.html",
      "reward": "/achievements.html"
    },
    {
      "page": "architect.html",
      "slug": "architect",
      "archetype": "command",
      "role": "Navigator",
      "verb": "DIRECT",
      "primaryAction": "decide",
      "actions": [
        "decide",
        "accept mission",
        "review standing"
      ],
      "successOutcome": "mission accepted",
      "district": "genesis",
      "districtName": "THE GENESIS QUARTER",
      "entry": "/architect.html",
      "mission": "/missions.html",
      "reward": "/achievements.html"
    },
    {
      "page": "architecture.html",
      "slug": "architecture",
      "archetype": "command",
      "role": "Navigator",
      "verb": "DIRECT",
      "primaryAction": "decide",
      "actions": [
        "decide",
        "accept mission",
        "review standing"
      ],
      "successOutcome": "mission accepted",
      "district": "genesis",
      "districtName": "THE GENESIS QUARTER",
      "entry": "/architecture.html",
      "mission": "/missions.html",
      "reward": "/achievements.html"
    },
    {
      "page": "arena.html",
      "slug": "arena",
      "archetype": "gaming",
      "role": "Champion",
      "verb": "COMPETE",
      "primaryAction": "play",
      "actions": [
        "play",
        "challenge",
        "rank",
        "claim reward"
      ],
      "successOutcome": "mastery recorded",
      "district": "arena",
      "districtName": "THE GAME ARENA",
      "entry": "/arena.html",
      "mission": "/missions.html",
      "reward": "/trophies.html"
    },
    {
      "page": "ascension.html",
      "slug": "ascension",
      "archetype": "command",
      "role": "Navigator",
      "verb": "DIRECT",
      "primaryAction": "decide",
      "actions": [
        "decide",
        "accept mission",
        "review standing"
      ],
      "successOutcome": "mission accepted",
      "district": "genesis",
      "districtName": "THE GENESIS QUARTER",
      "entry": "/ascension.html",
      "mission": "/missions.html",
      "reward": "/achievements.html"
    },
    {
      "page": "atlas.html",
      "slug": "atlas",
      "archetype": "command",
      "role": "Navigator",
      "verb": "DIRECT",
      "primaryAction": "decide",
      "actions": [
        "decide",
        "accept mission",
        "review standing"
      ],
      "successOutcome": "mission accepted",
      "district": "genesis",
      "districtName": "THE GENESIS QUARTER",
      "entry": "/atlas.html",
      "mission": "/missions.html",
      "reward": "/achievements.html"
    },
    {
      "page": "automation.html",
      "slug": "automation",
      "archetype": "command",
      "role": "Navigator",
      "verb": "DIRECT",
      "primaryAction": "decide",
      "actions": [
        "decide",
        "accept mission",
        "review standing"
      ],
      "successOutcome": "mission accepted",
      "district": "genesis",
      "districtName": "THE GENESIS QUARTER",
      "entry": "/automation.html",
      "mission": "/missions.html",
      "reward": "/achievements.html"
    },
    {
      "page": "autonomous-insights.html",
      "slug": "autonomous-insights",
      "archetype": "command",
      "role": "Navigator",
      "verb": "DIRECT",
      "primaryAction": "decide",
      "actions": [
        "decide",
        "accept mission",